{
  "$schema": "./schemas/taxonomy.schema.json",
  "schemaVersion": 1,
  "lastVerified": "2026-10-16",
  "publicFamilies": [
    {
      "id": "project",
      "label": "Open Projects",
      "description": "Installable software, libraries, developer tools, hardware, packages, and creative projects."
    },
    {
      "id": "research",
      "label": "Open Research",
      "description": "Papers, experiments, datasets, models, protocols, and reproducible research artifacts."
    },
    {
      "id": "service",
      "label": "Open Services",
      "description": "Hosted applications and shared infrastructure operated by Elixpo."
    }
  ],
  "repositoryDispositions": [
    "public-entry",
    "supporting-repository",
    "duplicate-or-redirect",
    "exclude"
  ],
  "relationships": [
    "core",
    "chapter",
    "member",
    "connected"
  ],
  "lifecycles": [
    "incubating",
    "active",
    "maintenance",
    "paused",
    "completed",
    "archived"
  ],
  "custody": [
    "elixpo-owned",
    "transferred-to-elixpo",
    "externally-owned",
    "mirrored"
  ],
  "verificationStates": [
    "verified",
    "decision-recorded",
    "needs-decision"
  ],
  "artifactTypes": [
    "application",
    "library",
    "cli",
    "package",
    "framework",
    "hardware",
    "paper",
    "experiment",
    "dataset",
    "model",
    "hosted-service",
    "api",
    "infrastructure",
    "website",
    "community",
    "brand-resource",
    "organization-meta"
  ],
  "operationalStates": [
    "online",
    "limited",
    "offline",
    "sunset",
    "not-applicable"
  ],
  "maturities": [
    "experimental",
    "alpha",
    "beta",
    "stable",
    "mature",
    "not-applicable"
  ],
  "chapterStatuses": [
    "proposed",
    "selected",
    "active",
    "released",
    "closed",
    "withdrawn"
  ]
}
